{
  "$schema": "./release-manifest.schema.json",
  "product": "ApiaryLens",
  "productVersion": "0.1.0-rc.1",
  "channel": "release-candidate",
  "sourceCommit": "458897a28bc4af72930ffe4a462c6a9b53400bfb",
  "buildTime": "2026-07-15T18:07:49.5736168Z",
  "contracts": {
    "api": "1.0",
    "sync": 1,
    "databaseMigration": "0003",
    "deploymentPlan": 1,
    "export": 1,
    "localStore": 1
  },
  "profiles": ["cloudflare", "compose"],
  "artifacts": [
    {
      "name": "apiarylens-0.1.0-rc.1-cloudflare-19777865d804.tar.gz",
      "kind": "deployment-bundle",
      "target": "cloudflare",
      "url": "https://apiarylens.org/releases/0.1.0-rc.1/artifacts/apiarylens-0.1.0-rc.1-cloudflare-19777865d804.tar.gz",
      "sha256": "19777865d804ee46c78024b464dc92b237cdaeb135563aec493feee6967b28af",
      "bytes": 605981
    },
    {
      "name": "apiarylens-0.1.0-rc.1-compose-6c5b64ecce37.tar.gz",
      "kind": "deployment-bundle",
      "target": "compose",
      "url": "https://apiarylens.org/releases/0.1.0-rc.1/artifacts/apiarylens-0.1.0-rc.1-compose-6c5b64ecce37.tar.gz",
      "sha256": "6c5b64ecce37c25e20795b0a273ad248f1843d0e12cc9c1cafc2edd17d7c6993",
      "bytes": 104272
    },
    {
      "name": "apiarylens-scout-bee-0.1.0-rc.1-windows-amd64.exe",
      "kind": "deployment-tool",
      "target": "windows-amd64",
      "url": "https://apiarylens.org/releases/0.1.0-rc.1/artifacts/apiarylens-scout-bee-0.1.0-rc.1-windows-amd64.exe",
      "sha256": "3647f38ed8a274dd7866ffe6bfba6b93c7754dff8e93b6014657f4c02f4a7392",
      "bytes": 7779840
    },
    {
      "name": "apiarylens-sbom.cdx.json",
      "kind": "sbom",
      "target": "release",
      "url": "https://apiarylens.org/releases/0.1.0-rc.1/apiarylens-sbom.cdx.json",
      "sha256": "c84d6a05093b84036a09283603b7e95f2c1c9107e8152acdf5f2d973c2a4b928",
      "bytes": 38511
    },
    {
      "name": "apiarylens-license-report.md",
      "kind": "license-report",
      "target": "release",
      "url": "https://apiarylens.org/releases/0.1.0-rc.1/apiarylens-license-report.md",
      "sha256": "58f81ee49d04c97511b9a5e6bbaa6b33c41227f74b7f10264dd0d68b485667bf",
      "bytes": 820
    },
    {
      "name": "apiarylens-provenance.intoto.jsonl",
      "kind": "provenance",
      "target": "release",
      "url": "https://apiarylens.org/releases/0.1.0-rc.1/apiarylens-provenance.intoto.jsonl",
      "sha256": "2ead29073f5ac14cc03223834c1e1a31025e3b2fa0d1605e37ec64ca866f1660",
      "bytes": 1134
    }
  ],
  "knownLimitations": [
    "Native iPhone and Android applications are post-MVP.",
    "AI, video, sensors, passkeys, and OIDC federation are post-MVP."
  ]
}
